{
  "$schema": "https://testatlas.dev/schemas/v1/flow.schema.json",
  "id": "FLOW-e2e-flows-e2e-create-item-end-to-end",
  "name": "E2E Create Item End To End",
  "domain": "domain-e2e-flows",
  "persona": "monorepo-tester",
  "priority": "medium",
  "status": "mapped",
  "confidence": "low",
  "goal": "Submit an item via apps/web/_testatlas/flows/FLOW-web-routing-submit-item-form.md, watch it POST to apps/api/_testatlas/flows/FLOW-items-api-create-item.md, and confirm validateItem from @repo/shared accepts the same shape on both ends.",
  "preconditions": [],
  "entryPoints": [],
  "expectedBehavior": [],
  "alternatePaths": [],
  "edgeCases": [],
  "failurePaths": [],
  "dataRequirements": [],
  "dependencies": [],
  "testScenarios": [],
  "evidence": [],
  "issues": [],
  "retestNotes": [],
  "lastUpdatedAt": "2026-05-03T00:00:00.000Z"
}
