{
  "$schema": "https://testatlas.dev/schemas/v1/flow.schema.json",
  "id": "FLOW-monorepo-architecture-package-version-sync-check",
  "name": "Package Version Sync Check",
  "domain": "domain-monorepo-architecture",
  "persona": "release-engineer",
  "priority": "medium",
  "status": "mapped",
  "confidence": "low",
  "goal": "Verify @repo/shared workspace:* protocol resolves to a single version across apps/web and apps/api after pnpm install",
  "preconditions": [],
  "entryPoints": [],
  "expectedBehavior": [],
  "alternatePaths": [],
  "edgeCases": [],
  "failurePaths": [],
  "dataRequirements": [],
  "dependencies": [],
  "testScenarios": [],
  "evidence": [],
  "issues": [],
  "retestNotes": [],
  "lastUpdatedAt": "2026-05-03T00:00:00.000Z"
}
