{
  "$schema": "https://testatlas.dev/schemas/v1/flow.schema.json",
  "id": "FLOW-dashboard-dashboard-navigation",
  "name": "Dashboard Navigation",
  "domain": "domain-dashboard",
  "persona": "returning-user",
  "priority": "medium",
  "status": "mapped",
  "confidence": "low",
  "goal": "Move between the dashboard home and settings as an authenticated user",
  "preconditions": [],
  "entryPoints": [],
  "expectedBehavior": [],
  "alternatePaths": [],
  "edgeCases": [],
  "failurePaths": [],
  "dataRequirements": [],
  "dependencies": [],
  "testScenarios": [],
  "evidence": [],
  "issues": [],
  "retestNotes": [],
  "lastUpdatedAt": "2026-05-03T00:00:00.000Z"
}
