{
  "$schema": "https://testatlas.dev/schemas/v1/flow.schema.json",
  "id": "FLOW-cli-complete-todo",
  "name": "Complete Todo",
  "domain": "domain-cli",
  "persona": "todo-author",
  "priority": "medium",
  "status": "mapped",
  "confidence": "low",
  "goal": "Flip a todo's status from open to done",
  "preconditions": [],
  "entryPoints": [],
  "expectedBehavior": [],
  "alternatePaths": [],
  "edgeCases": [],
  "failurePaths": [],
  "dataRequirements": [],
  "dependencies": [],
  "testScenarios": [],
  "evidence": [],
  "issues": [],
  "retestNotes": [],
  "lastUpdatedAt": "2026-05-03T00:00:00.000Z"
}
