{
  "$schema": "https://testatlas.dev/schemas/v1/flow.schema.json",
  "id": "FLOW-api-health-check",
  "name": "Health Check",
  "domain": "domain-api",
  "persona": "ops-engineer",
  "priority": "medium",
  "status": "mapped",
  "confidence": "low",
  "goal": "Confirm the application process is responsive via GET /api/health",
  "preconditions": [],
  "entryPoints": [],
  "expectedBehavior": [],
  "alternatePaths": [],
  "edgeCases": [],
  "failurePaths": [],
  "dataRequirements": [],
  "dependencies": [],
  "testScenarios": [],
  "evidence": [],
  "issues": [],
  "retestNotes": [],
  "lastUpdatedAt": "2026-05-03T00:00:00.000Z"
}
