{
  "$schema": "https://testatlas.dev/schemas/v1/flow.schema.json",
  "id": "FLOW-validation-validate-item",
  "name": "Validate Item",
  "domain": "domain-validation",
  "persona": "api-client",
  "priority": "medium",
  "status": "mapped",
  "confidence": "low",
  "goal": "POST /api/items with a missing title, expect 400 and an error object",
  "preconditions": [],
  "entryPoints": [],
  "expectedBehavior": [],
  "alternatePaths": [],
  "edgeCases": [],
  "failurePaths": [],
  "dataRequirements": [],
  "dependencies": [],
  "testScenarios": [],
  "evidence": [],
  "issues": [],
  "retestNotes": [],
  "lastUpdatedAt": "2026-05-03T00:00:00.000Z"
}
