{
  "$schema": "https://testatlas.dev/schemas/v1/flow.schema.json",
  "id": "FLOW-web-components-submit-item-form",
  "name": "Submit Item Form",
  "domain": "domain-web-components",
  "persona": "item-author",
  "priority": "medium",
  "status": "mapped",
  "confidence": "low",
  "goal": "Type a non-empty title, click Add Item, see the item appended to the list",
  "preconditions": [],
  "entryPoints": [],
  "expectedBehavior": [],
  "alternatePaths": [],
  "edgeCases": [],
  "failurePaths": [],
  "dataRequirements": [],
  "dependencies": [],
  "testScenarios": [],
  "evidence": [],
  "issues": [],
  "retestNotes": [],
  "lastUpdatedAt": "2026-05-03T00:00:00.000Z"
}
