{
  "$schema": "https://testatlas.dev/schemas/v1/flow.schema.json",
  "id": "FLOW-auth-logout",
  "name": "Logout",
  "domain": "domain-auth",
  "persona": "returning-user",
  "priority": "medium",
  "status": "mapped",
  "confidence": "low",
  "goal": "Clear the session cookie and return to the marketing landing page",
  "preconditions": [],
  "entryPoints": [],
  "expectedBehavior": [],
  "alternatePaths": [],
  "edgeCases": [],
  "failurePaths": [],
  "dataRequirements": [],
  "dependencies": [],
  "testScenarios": [],
  "evidence": [],
  "issues": [],
  "retestNotes": [],
  "lastUpdatedAt": "2026-05-03T00:00:00.000Z"
}
