{
  "$schema": "https://testatlas.dev/schemas/v1/flow.schema.json",
  "id": "FLOW-items-api-list-items",
  "name": "List Items",
  "domain": "domain-items-api",
  "persona": "api-client",
  "priority": "medium",
  "status": "mapped",
  "confidence": "low",
  "goal": "GET /api/items, expect 200 with an items array (possibly empty)",
  "preconditions": [],
  "entryPoints": [],
  "expectedBehavior": [],
  "alternatePaths": [],
  "edgeCases": [],
  "failurePaths": [],
  "dataRequirements": [],
  "dependencies": [],
  "testScenarios": [],
  "evidence": [],
  "issues": [],
  "retestNotes": [],
  "lastUpdatedAt": "2026-05-03T00:00:00.000Z"
}
