{
  "$schema": "https://testatlas.dev/schemas/v1/flow.schema.json",
  "id": "FLOW-tasks-task-crud",
  "name": "Task CRUD",
  "domain": "domain-tasks",
  "persona": "task-owner",
  "priority": "medium",
  "status": "mapped",
  "confidence": "low",
  "goal": "Create, list, update, and delete tasks via the API",
  "preconditions": [],
  "entryPoints": [],
  "expectedBehavior": [],
  "alternatePaths": [],
  "edgeCases": [],
  "failurePaths": [],
  "dataRequirements": [],
  "dependencies": [],
  "testScenarios": [],
  "evidence": [],
  "issues": [],
  "retestNotes": [],
  "lastUpdatedAt": "2026-05-03T00:00:00.000Z"
}
