{
  "$schema": "https://testatlas.dev/schemas/v1/flow.schema.json",
  "id": "FLOW-mobile-screens-feed-tab-load",
  "name": "Feed Tab Load",
  "domain": "domain-mobile-screens",
  "persona": "returning-user",
  "priority": "medium",
  "status": "mapped",
  "confidence": "low",
  "goal": "Render the FlatList of mock posts inside the bottom-tab feed route",
  "preconditions": [],
  "entryPoints": [],
  "expectedBehavior": [],
  "alternatePaths": [],
  "edgeCases": [],
  "failurePaths": [],
  "dataRequirements": [],
  "dependencies": [],
  "testScenarios": [],
  "evidence": [],
  "issues": [],
  "retestNotes": [],
  "lastUpdatedAt": "2026-05-03T00:00:00.000Z"
}
