{
  "$schema": "https://testatlas.dev/schemas/v1/flow.schema.json",
  "id": "FLOW-web-routing-landing-page-load",
  "name": "Landing Page Load",
  "domain": "domain-web-routing",
  "persona": "first-visit",
  "priority": "medium",
  "status": "mapped",
  "confidence": "low",
  "goal": "Visit / and see the Repo Web heading and an empty items list",
  "preconditions": [],
  "entryPoints": [],
  "expectedBehavior": [],
  "alternatePaths": [],
  "edgeCases": [],
  "failurePaths": [],
  "dataRequirements": [],
  "dependencies": [],
  "testScenarios": [],
  "evidence": [],
  "issues": [],
  "retestNotes": [],
  "lastUpdatedAt": "2026-05-03T00:00:00.000Z"
}
