{
  "$schema": "https://testatlas.dev/schemas/v1/flow.schema.json",
  "id": "FLOW-auth-signup-new-account",
  "name": "Signup New Account",
  "domain": "domain-auth",
  "persona": "new-user",
  "priority": "medium",
  "status": "mapped",
  "confidence": "low",
  "goal": "Create a new account via /api/auth/signup and receive a session cookie",
  "preconditions": [],
  "entryPoints": [],
  "expectedBehavior": [],
  "alternatePaths": [],
  "edgeCases": [],
  "failurePaths": [],
  "dataRequirements": [],
  "dependencies": [],
  "testScenarios": [],
  "evidence": [],
  "issues": [],
  "retestNotes": [],
  "lastUpdatedAt": "2026-05-03T00:00:00.000Z"
}
