{
  "$schema": "https://testatlas.dev/schemas/v1/flow.schema.json",
  "id": "FLOW-marketing-view-landing-page",
  "name": "View Landing Page",
  "domain": "domain-marketing",
  "persona": "anonymous-visitor",
  "priority": "medium",
  "status": "mapped",
  "confidence": "low",
  "goal": "Render the marketing home page and follow the sign-in or sign-up CTA",
  "preconditions": [],
  "entryPoints": [],
  "expectedBehavior": [],
  "alternatePaths": [],
  "edgeCases": [],
  "failurePaths": [],
  "dataRequirements": [],
  "dependencies": [],
  "testScenarios": [],
  "evidence": [],
  "issues": [],
  "retestNotes": [],
  "lastUpdatedAt": "2026-05-03T00:00:00.000Z"
}
